productName,itemId,commissionRate,commission,price,sales,imageUrl,shopName,productLink,offerLink,ratingStar
Mini Aspirador de Pó Portátil Automotivo Casa Sem Fio 3 em 1 Recarregável Potente 6000Pa,23093489477,0.07,2.0286,28.98,8972,https://cf.shopee.com.br/file/br-11134207-7r98o-m6drf7xctphs1a,Mega TechStore,https://shopee.com.br/product/872424585/23093489477,https://s.shopee.com.br/2qJ5umpnLR,4.7
Tira manchas alvejante 1kg + Percarbonato de sódio 1kg,23193680985,0.09,2.25,25,36617,https://cf.shopee.com.br/file/br-11134207-7r98o-m5q7asdx9eiad2,Ans Agrária,https://shopee.com.br/product/512962451/23193680985,https://s.shopee.com.br/30cW75pA0U,4.8
Inox Prata Torneira com chuveiro com rotação de 360° Cozinha Luxo Parede Promoção,21097736963,0.23,7.3577,31.99,16004,https://cf.shopee.com.br/file/br-11134207-7r98o-m7w5vzxxa41d1f,INFINITY COMERCIO DE VARIEDADES,https://shopee.com.br/product/1003085235/21097736963,https://s.shopee.com.br/3AvwJOoWfX,4.8
ROMANTIC CROWN Meia-Calça Térmica Forrada Peluciada Translúcida De Lã Quente Feminina Para Inverno,23097434087,0.08,2.3992,29.99,49274,https://cf.shopee.com.br/file/br-11134207-7r98o-lvzh39z154za59,Romantic Crown,https://shopee.com.br/product/1198407784/23097434087,https://s.shopee.com.br/7KlVH3YfDM,4.9
Mesas de Cabeceira Retro para Quarto Casal ou Solteiro Nicho Decoração Palma,21599248399,0.08,2.792,34.9,16249,https://cf.shopee.com.br/file/sg-11134201-7rd6x-luv5vclgwaxb45,Eggers Móveis Modulados,https://shopee.com.br/product/594157579/21599248399,https://s.shopee.com.br/7V4vTMY1sP,4.8
Calça Pantalona Alfaiataria Premium Com Bolso PROMOÇÃO,44451988896,0.03,1.137,37.9,5739,https://cf.shopee.com.br/file/br-11134207-7r98o-ma4qg4onmdjb35,valiosa fashion moda,https://shopee.com.br/product/1077139873/44451988896,https://s.shopee.com.br/7fOLffXOXS,4.7
Conjunto 6 Copos de Vidro 190ml Amazon Nadir,22893597310,0.03,0.3897,12.99,1212,https://cf.shopee.com.br/file/sg-11134201-7ra1q-m4rhhhf6d4qp18,Casa & Vídeo,https://shopee.com.br/product/412968566/22893597310,https://s.shopee.com.br/7phlryWlCV,4.8
Castanha de Caju 1Kg (Com ou sem Sal) - P&P,23895716611,0.08,4.792,59.9,19494,https://cf.shopee.com.br/file/efbcc2a5f6b90cd3020e763f5e243a40,P&P FIT,https://shopee.com.br/product/394192376/23895716611,https://s.shopee.com.br/6fVoTpbCZI,4.7
Relógio À Prova D'água LED Digital de Pulso Esportivo feminino Masculino Ultra9 Esporte Pulseira De Silicone novo 2024,23397324970,0.03,0.417,13.9,1755,https://cf.shopee.com.br/file/br-11134207-7r98o-lr7g6pzaeed783,T&TBem_vindo.br,https://shopee.com.br/product/465639879/23397324970,https://s.shopee.com.br/6ppEg8aZEL,4.3
Kit com 3 Quadros Decorativos + Frase Abençoados por Deus - Decoração para Sala e Quarto em mdf,22893393971,0.13,1.677,12.9,6508,https://cf.shopee.com.br/file/br-11134207-7r98o-m0oxl1vahn5tf1,MQuadros Decor,https://shopee.com.br/product/494422638/22893393971,https://s.shopee.com.br/708esRZvtO,4.7
Kit 10 Petisqueira Barquinha Canoa Petiscos Churrasco Festa Frios Para Servir Amendoim Caldo Branca,22698377160,0.07,1.7486,24.98,11866,https://cf.shopee.com.br/file/br-11134207-7r98o-mayetijosmihf1,A T E N A S,https://shopee.com.br/product/1265597786/22698377160,https://s.shopee.com.br/7AS54kZIYR,4.8
Lixeira Suspensa Multiuso 9L Com Tampa Retrátil Sem Furo Porta Armário Para Cozinha Banheiro,23092480203,0.08,2.4792,30.99,3265,https://cf.shopee.com.br/file/br-11134207-7r98o-lm7nuwbtr03bc9,BOMM FAMILIA,https://shopee.com.br/product/979724994/23092480203,https://s.shopee.com.br/60G7gbdjvE,4.8
Kit 10 Marmita Potes 800ml com Travas Laterais BPA FREE - Alimentos organizadores de congelador,22998068286,0.03,1.1097,36.99,22430,https://cf.shopee.com.br/file/br-11134207-7r98o-m8z01lbiwfluba,glmixutilidades02_,https://shopee.com.br/product/1340752713/22998068286,https://s.shopee.com.br/6AZXsud6aH,4.7
KIT Calcinha Calçola Cintura Alta Microfibra Lisa Redutora Luxo Lateral Larga Conforto Lingerie,22698367801,0.13,3.497,26.9,2735,https://cf.shopee.com.br/file/sg-11134201-7renx-m80vcyxe2r7af1,Friburgo Oversize,https://shopee.com.br/product/1271897145/22698367801,https://s.shopee.com.br/6Ksy5DcTFK,4.7
Mini carregador portatil power bank para celular IPNHONE Samsung Xiaomi,22497163394,0.11,3.0679,27.89,2504,https://cf.shopee.com.br/file/br-11134207-7r98o-loibrjthumz0b1,Inovar Top,https://shopee.com.br/product/944725778/22497163394,https://s.shopee.com.br/6VCOHWbpuN,4.6
Areia Catbio Biodegradável 4 Kg - Max Clean - Grãos Finos,22996121313,0.07,3.143,44.9,16770,https://cf.shopee.com.br/file/br-11134207-7r98o-m605sjhkzmtse8,petpremier,https://shopee.com.br/product/1023760886/22996121313,https://s.shopee.com.br/5L0QtNgHHA,4.9
kit Coala Home Chá Branco,20697874559,0.15,11.49,76.6,22346,https://cf.shopee.com.br/file/sg-11134201-7rdwg-m0j6jm49q7nyd4,Coala Essências Oficial,https://shopee.com.br/product/1177903362/20697874559,https://s.shopee.com.br/5VJr5gfdwD,4.9
Travesseiro MAGNÉTICO com Infravermelho Altura Médio Ortopédico  Anti ronco Anatômico Alivia Dor,22793263480,0.03,0.717,23.9,8164,https://cf.shopee.com.br/file/br-11134207-7r98o-lzs2iaeznrthc5,SUPPREMO SONO,https://shopee.com.br/product/1139157240/22793263480,https://s.shopee.com.br/5fdHHzf0bG,4.4
Kit  Fone 13 TWS Sem Fio Bluetooth 5.0 Air Pro 3 Fone De Ouvido Esportivo Com Microfone MING,22693557231,0.08,1.664,20.8,8285,https://cf.shopee.com.br/file/br-11134207-7r98o-m329iu8jc1s51a,Super store!,https://shopee.com.br/product/997025684/22693557231,https://s.shopee.com.br/5pwhUIeNGJ,4.6
Lola Cosmetics Argan Oil Óleo Capilar 50ml,18760178533,0.12,2.148,17.9,10186,https://cf.shopee.com.br/file/sg-11134201-22110-k9xhfx0wshjv41,AMOBELEZA,https://shopee.com.br/product/681570887/18760178533,https://s.shopee.com.br/9zmGRxOVo8,5
"Kit com 6,3,1 pares de meias/meias soquete térmica grossa flanelada fleece inverno frio intenso",22797608073,0.03,0.2694,8.98,1663,https://cf.shopee.com.br/file/sg-11134201-7rd68-lx0jgig8q4ps48,Amor 2 .presentes,https://shopee.com.br/product/1161888171/22797608073,https://s.shopee.com.br/3VYmi14r7J,4.8
Cobertor Casal Queen Fofão Coberta Luxuosa Frio Inverno Antialérgica *Oferta*,23994031816,0.08,3.592,44.9,602,https://cf.shopee.com.br/file/sg-11134201-7raur-ma4a3vvx2g27af,Ofertas Do Lar,https://shopee.com.br/product/487255442/23994031816,https://s.shopee.com.br/3fsCuK4DmM,3.2
"Kit 10 Limpador de máquina de lavar, comprimido efervescente sólido para remover manchas",23892665618,0.15,3.2985,21.99,16171,https://cf.shopee.com.br/file/br-11134207-7r98o-lv98cwwitsix1e,Inovar Top,https://shopee.com.br/product/944725778/23892665618,https://s.shopee.com.br/3qBd6d3aRP,4.7
caneca Kit Garrafa Térmica Vacuum Bottle Inox 500ml + 3 Xícaras Bebidas Fria ou Quente,22192647025,0.07,2.0279,28.97,12178,https://cf.shopee.com.br/file/sg-11134201-7rfgr-m9srcfiqmq8s1a,XIXI-STORE3,https://shopee.com.br/product/1108921660/22192647025,https://s.shopee.com.br/2fzfiU81oC,4.7
Robô Varredora/Aspirador De Pó 1200PA Automática 3 Em 1 Limpeza Doméstica Robótico Inteligente E Silencioso,22597120770,0.14,8.246,58.9,4475,https://cf.shopee.com.br/file/br-11134207-7r98o-lo8epw1nrmbw14,JX VERDE,https://shopee.com.br/product/1103946075/22597120770,https://s.shopee.com.br/2qJ5un7OTF,4.3
Jogo de Cama Lençol 400 Fios Micropercal,23793614115,0.15,4.185,27.9,20222,https://cf.shopee.com.br/file/br-11134207-7r98o-m4q44496tu0x8f,Casa Decorada Enxovais,https://shopee.com.br/product/418872496/23793614115,https://s.shopee.com.br/30cW766l8I,4.8
Kit 10 Calcinhas Cós Alto Sem Costura Corte A Laser Academia  - Cos Roma,20899367498,0.03,0.7224,24.08,840,https://cf.shopee.com.br/file/sg-11134201-7rdw0-lz0w37j1cnpi4f,Lingerie da Serra,https://shopee.com.br/product/450671586/20899367498,https://s.shopee.com.br/3AvwJP67nL,4.3
Sanduicheira Elétrica Misteira Multifunções SAN400 Preto - Cadence,22893496298,0.08,10.392,129.9,54,https://cf.shopee.com.br/file/br-11134207-7r98o-m1ziu831ixgkf1,Tubarão Max,https://shopee.com.br/product/1314243679/22893496298,https://s.shopee.com.br/20jyvGAZA8,4.9
Mini Aspirador De pó Portátil Automotivo e Casa Potente Recarregável,22791523448,0.07,1.4623,20.89,8457,https://cf.shopee.com.br/file/sg-11134201-7rfgh-m9alnusjaitc3e,ANJ.GG store,https://shopee.com.br/product/391739739/22791523448,https://s.shopee.com.br/2B3P7Z9vpB,4.6
Kit Jogo Lençol Cama Box Casal Queen 400 fios Micropercal 03 Peças Ponto Palito,22893738408,0.03,0.615,20.5,57598,https://cf.shopee.com.br/file/br-11134207-7r98o-m6peqntiscvk4c,Nosso Lar Enxovais,https://shopee.com.br/product/313660590/22893738408,https://s.shopee.com.br/2LMpJs9IUE,4.9
Caixa De Som C/ Microfones Karaokê Brincadeiras em Família,22892981683,0.08,2.1504,26.88,7977,https://cf.shopee.com.br/file/br-11134207-7r98o-lum8q7tobtd144,NOVASHOP_BRASIL,https://shopee.com.br/product/1170622375/22892981683,https://s.shopee.com.br/2VgFWB8f9H,4.8
"Cortina para Quarto, Cozinha, Sala Blackout Blecaute 2,80 x 2,30 PVC Corta Luz 100%",23793260648,0.13,4.4577,34.29,4401,https://cf.shopee.com.br/file/br-11134207-7r98o-m035ag65ltuvc1,DICO DECOR,https://shopee.com.br/product/345755167/23793260648,https://s.shopee.com.br/1LUI82D6W4,4.8
Kit 15 Potes Herméticos de Plástico com Tampa – Empilháveis e Ultra Resistentes para Alimentos,18298053473,0.03,0.897,29.9,6104,https://cf.shopee.com.br/file/br-11134207-7r98o-m3v6qy5esmydcc,D&L Utilidades,https://shopee.com.br/product/449434162/18298053473,https://s.shopee.com.br/1VniKLCTB7,4.6
Capa Para Colchão Impermeavel Matelado Com Elastico,22992945609,0.1,2.28,22.8,37880,https://cf.shopee.com.br/file/br-11134207-7r98o-ltwjwwwq5uudff,Icasa Ibitinga,https://shopee.com.br/product/300779622/22992945609,https://s.shopee.com.br/1g78WeBpqA,4.6
Kit 3 Unidades Sabonete Líquido Chá Branco 500 ml,22792887317,0.15,5.985,39.9,9223,https://cf.shopee.com.br/file/sg-11134201-7rcdm-lsmmx91ngz5jbd,Coala Essências Oficial,https://shopee.com.br/product/1177903362/22792887317,https://s.shopee.com.br/1qQYixBCVD,4.9
Kit 16 Pçs/Set Profissional Aço inoxidável Para Manicure Pedicure,23493397958,0.11,2.09,19,5939,https://cf.shopee.com.br/file/br-11134207-7r98o-m0ommf0cmjbx79,Arara.store,https://shopee.com.br/product/1005980154/23493397958,https://s.shopee.com.br/gEbKoFds0,4.6
"kit Tapete para Banheiro de Secagem Rápida e Super Absorvente - Ideal para Chuveiro, Cozinha e Varanda",22097308942,0.08,1.0392,12.99,17285,https://cf.shopee.com.br/file/br-11134207-7r98o-lqnow85afhun2a,HH IMPORTADORA,https://shopee.com.br/product/1072624004/22097308942,https://s.shopee.com.br/qY1X7F0X3,4.4
Kit 2 Travesseiro Pluma de Ganso Descanso Antiacaro 70x50cm,19798930110,0.14,4.6886,33.49,15696,https://cf.shopee.com.br/file/sg-11134201-7rbki-ll9jwp6mt5ytad,Alice Confecções,https://shopee.com.br/product/301990718/19798930110,https://s.shopee.com.br/10rRjQENC6,4.8
Caixa Saco Organizador Cobertor Casaco Guarda Roupa Ecológico Anti-Poeira Umidade Insetos Multiuso,23592798319,0.09,1.4292,15.88,17049,https://cf.shopee.com.br/file/br-11134207-7r98o-lv97hnenxksvb5,Oncomercio Shop,https://shopee.com.br/product/518270617/23592798319,https://s.shopee.com.br/1BArvjDjr9,4.9
"Varão Extensivo Ajustável 0,45m à 1,50m Para Cortina Branco de Box Banheiro Suporte Extensor",21597475362,0.03,0.3297,10.99,4019,https://cf.shopee.com.br/file/br-11134207-7r98o-lynxvqpqd0ytb7,IMPERIAL SUPORTES,https://shopee.com.br/product/524520001/21597475362,https://s.shopee.com.br/yuXaIBDw,4.8
Caixa De Som Go 3 Bluetooth Portátil À Prova D 'Água Com Bateria Esportiva,23498013829,0.14,6.1306,43.79,8244,https://cf.shopee.com.br/file/sg-11134201-7repd-m28gs3389mz9ec,Inovar Top,https://shopee.com.br/product/944725778/23498013829,https://s.shopee.com.br/708esS4jOS,4.6
Kit Lençol Cama Casal Queen 400 fios Micropercal 03 Peças Ponto Palito,18499246242,0.13,2.509,19.3,14056,https://cf.shopee.com.br/file/br-11134207-7r98o-luunp358lk7o00,Enxovais.Store,https://shopee.com.br/product/289796446/18499246242,https://s.shopee.com.br/7AS54l463V,4.8
Sapateira 4 ou 5 Andares Multiuso Desmontável Organizadora Multiuso Sapatos Livros Brinquedos,21797631048,0.07,1.3986,19.98,9744,https://cf.shopee.com.br/file/br-11134207-7r98o-m275pnv5hbnq94,DonaLarana_Casa,https://shopee.com.br/product/771750144/21797631048,https://s.shopee.com.br/6fVoTq604Q,4.6
Lanterna Super Potente Tática Mais Forte Do Mundo Potente Sitio Fazenda Acampamento Camping Segurança,18699319983,0.07,1.3993,19.99,1985,https://cf.shopee.com.br/file/sg-11134201-7rd47-lwd7tbwo93v61c,LOJA 15 IMPORTADOS,https://shopee.com.br/product/915563136/18699319983,https://s.shopee.com.br/6ppEg95MjT,4.6
Quadro decorativo Arte de Parede Moderna Árvore da Fortuna – Decoração de Tela Sem Moldura com Árvo,22293829267,0.17,3.23,19,30,https://cf.shopee.com.br/file/br-11134207-7r98o-m79k17o1eisy6e,GALERIA ONLINE MFN,https://shopee.com.br/product/1383550892/22293829267,https://s.shopee.com.br/7fOLfg2C2e,4.4
Caneta Paint Original Reparadora Pintura Automotiva Permanente Não Sai Na Água Tira Riscos Carro Moto Retoque de Placa Tênis Pneus para Ferro Metal Madeira Plástico Gesso Vidro Couro Tecido Cores Preto Branco Prata (Cinza) Dourado Azul Vermelha,21399069053,0.1,2.185,21.85,7055,https://cf.shopee.com.br/file/br-11134207-7r98o-lsirz2r48wfv6e,VENDAS.VTO,https://shopee.com.br/product/603381147/21399069053,https://s.shopee.com.br/7phlrz1Yhh,4.6
Legging Flanelada Feminina Peluciada Quentinha Inverno,23592928586,0.1,2.799,27.99,17023,https://cf.shopee.com.br/file/br-11134207-7r98o-lthcaqt8y3vtea,AUGE MODAS CONFECÇÕES,https://shopee.com.br/product/1046016014/23592928586,https://s.shopee.com.br/7KlVH43Sic,4.7
Kit 7 Pecas Bolsa Organizadoras Para Mala Roupas Bagagem Viagem,22719293954,0.08,2.1272,26.59,6506,https://cf.shopee.com.br/file/br-11134207-7r98o-lungd923nxqs3c,RAJORK SHOP_BRASIL,https://shopee.com.br/product/800287152/22719293954,https://s.shopee.com.br/7V4vTN2pNf,4.9
Jogo de Copos Nadir Amazon em Vidro Transparente 6 Peças 190ml,22797916999,0.03,0.2997,9.99,705,https://cf.shopee.com.br/file/sg-11134201-7ra40-mbchxyo2uwrma7,Le biscuit®,https://shopee.com.br/product/1050213612/22797916999,https://s.shopee.com.br/5fdHI09o6K,4.8
Luminárias Led S/ Fio Com Sensor Presença Usb Recarregável Luz Quente e Fria,23392569372,0.11,1.6489,14.99,1375,https://cf.shopee.com.br/file/br-11134207-7r98o-lz9lo585oiadba,BoxFastTech,https://shopee.com.br/product/390273439/23392569372,https://s.shopee.com.br/5pwhUJ9AlN,4.8
Batedor Misturador Mixer Elétrico para Bebidas Leite Café Clara de Ovo 2 em 1,22392992790,0.11,2.7478,24.98,7826,https://cf.shopee.com.br/file/sg-11134201-7rd48-lupf3z3a40mxf1,Isabela Top,https://shopee.com.br/product/415175805/22392992790,https://s.shopee.com.br/5L0QtOB4mI,4.8
Kit 5 calcinhas plus do M ao GG3 Microfibra rebeka,20097682402,0.18,6.822,37.9,2721,https://cf.shopee.com.br/file/br-11134207-7r98o-m3m0wbpb8zlh5f,use Relise,https://shopee.com.br/product/582653614/20097682402,https://s.shopee.com.br/5VJr5hARRL,4.8
Cesto De Roupas De Bambu 50 Litros Yikasa,23394141936,0.03,1.47,49,23,https://cf.shopee.com.br/file/sg-11134201-7ravk-matwbx40ufddde,Melhor Compra Oficial,https://shopee.com.br/product/1409811653/23394141936,https://s.shopee.com.br/6Ksy5E7GkW,4.9
Varal De Chão Roupa Calcinha Grade 3 Andares Dobrável Portátil,21071530577,0.11,10.439,94.9,9277,https://cf.shopee.com.br/file/br-11134207-7r98o-m7augbm6ixf693,Na Web Group De Marcas ,https://shopee.com.br/product/325008325/21071530577,https://s.shopee.com.br/6VCOHX6dPZ,4.8
𝗘𝘀𝗽𝗲𝗹𝗵𝗼 𝗔𝗱𝗲𝘀𝗶𝘃𝗼 𝗔𝘂𝘁𝗼 𝗖𝗼𝗹𝗮𝗻𝘁𝗲 𝗔𝗰𝗿𝗶́𝗹𝗶𝗰𝗼 𝗙𝗹𝗲𝘅𝗶́𝘃𝗲𝗹 𝗕𝗮𝗻𝗵𝗲𝗶𝗿𝗼 𝗦𝗮𝗹𝗮 𝗣𝗹𝗮𝗰𝗮 𝗥𝗲𝘁𝗮𝗻𝗴𝘂𝗹𝗮𝗿 𝗢𝘃𝗮𝗹 𝗗𝗲𝗰𝗼𝗿𝗮𝘁𝗶𝘃𝗼,22097747332,0.13,2.3153,17.81,577,https://cf.shopee.com.br/file/br-11134207-7r98o-m9ssynhjczspb5,Point Mais Ecom,https://shopee.com.br/product/358431905/22097747332,https://s.shopee.com.br/60G7gc8XQU,4.2
Kit Spray Capilar Meu liso + Spray Capilar efeito GLOSS MULTIFUNCIONAL  BANHO BRILHANTE 200ml cada,18899229598,0.1,1.99,19.9,5390,https://cf.shopee.com.br/file/sg-11134201-7rd62-luthcukfw55s1d,Realce Beaute,https://shopee.com.br/product/321104773/18899229598,https://s.shopee.com.br/6AZXsv7u5X,4.7
Protetor Para Colchão Casal Queen 100% Impermeavel Capa com Elastico em Toda Volta,18997811463,0.07,1.883,26.9,1112,https://cf.shopee.com.br/file/br-11134207-7r98o-m7qimocqb7v874,Mariano Enxovais,https://shopee.com.br/product/293115208/18997811463,https://s.shopee.com.br/9f9Q3LuZzE,4.7
OFERTA Conjunto 3 Escovas De Aço Cabo Longo Multifuncional 21.5cm ou 17cm Multiuso Utensilio,13716348617,0.1,1.099,10.99,2160,https://cf.shopee.com.br/file/br-11134207-7r98o-lwk36xet1riq79,Fenix atacadista,https://shopee.com.br/product/478733087/13716348617,https://s.shopee.com.br/9pSqFetweH,4.9
"Manta Líquida Emborrachada Impermeabilizante Garin Cores 1,2kg",23495554195,0.07,2.093,29.9,1871,https://cf.shopee.com.br/file/br-11134207-7r98q-llclnjos1ikrab,old river,https://shopee.com.br/product/410582838/23495554195,https://s.shopee.com.br/9KWZejvqfC,4.8
"Kit 6 Perfumes Femininos (God Gil, La Vi, N°5, Scanda, 212 VP Ros, J'ador)",20499711989,0.03,0.447,14.9,467,https://cf.shopee.com.br/file/sg-11134201-7reqh-m8q9hqvvrtt5a8,Natalia & Glam,https://shopee.com.br/product/1478883100/20499711989,https://s.shopee.com.br/9Upzr2vDKF,4.1
